analysis,title,file_name,description
01_credibility_weight,Credibility Weight Parameters,01_scenario_metric_overview.png,Scenario-level comparison across prediction and operation metrics.
01_credibility_weight,Credibility Weight Parameters,02_delta_vs_base_model.png,Metric changes relative to the base model.
01_credibility_weight,Credibility Weight Parameters,03_station_mae_heatmap.png,Station-level MAE heatmap across scenarios.
01_credibility_weight,Credibility Weight Parameters,04_zone_mae_comparison.png,Zone-level MAE comparison across scenarios.
01_credibility_weight,Credibility Weight Parameters,05_operational_risk_comparison.png,Inventory-risk comparison across scenarios.
01_credibility_weight,Credibility Weight Parameters,06_mae_stock_tradeoff.png,Tradeoff between prediction MAE and inventory trajectory error.
