analysis,title,file_name,description
03_zone_shrinkage,Functional-Zone Shrinkage Strength,01_scenario_metric_overview.png,Scenario-level comparison across prediction and operation metrics.
03_zone_shrinkage,Functional-Zone Shrinkage Strength,02_delta_vs_base_model.png,Metric changes relative to the base model.
03_zone_shrinkage,Functional-Zone Shrinkage Strength,03_station_mae_heatmap.png,Station-level MAE heatmap across scenarios.
03_zone_shrinkage,Functional-Zone Shrinkage Strength,04_zone_mae_comparison.png,Zone-level MAE comparison across scenarios.
03_zone_shrinkage,Functional-Zone Shrinkage Strength,05_operational_risk_comparison.png,Inventory-risk comparison across scenarios.
03_zone_shrinkage,Functional-Zone Shrinkage Strength,06_mae_stock_tradeoff.png,Tradeoff between prediction MAE and inventory trajectory error.
